<?xml version="1.0" encoding="utf-8"?>
<xs:schema xmlns:xs="http://www.w3.org/2001/XMLSchema"
    targetNamespace="https://www.example.com"
    xmlns="https://www.example.com"
    elementFormDefault="qualified">

    <xs:element name="retail">
        <xs:complexType>
            <xs:sequence>
                <xs:element name="price" type="xs:decimal"/>
                <xs:element name="name" type="xs:string"/>
                <xs:element name="type" type="xs:string"/>
                <xs:element name="dop">
                    <xs:complexType>
                        <xs:sequence>
                            <xs:element name="year" type="xs:integer"/>
                            <xs:element name="month" type="xs:string"/>
                            <xs:element name="date" type="xs:integer"/>
                        </xs:sequence>
                    </xs:complexType>
                </xs:element>
                <xs:element name="exp">
                    <xs:complexType>
                        <xs:sequence>
                            <xs:element name="year" type="xs:integer"/>
                            <xs:element name="month" type="xs:string"/>
                            <xs:element name="date" type="xs:integer"/>
                        </xs:sequence>
                    </xs:complexType>
                </xs:element>
            </xs:sequence>
        </xs:complexType>
    </xs:element>

</xs:schema>
